{
  "brand_id": "nexus-tech",
  "company_name": "Nexus Technologies",
  "source_inputs": [
    {"type": "manual", "values": {"primary_color": "0F4C81", "secondary_color": "6BA3D6", "font_preference": "Inter"}}
  ],
  "palette": {
    "primary": "0F4C81",
    "secondary": "6BA3D6",
    "accent": "E07A2F",
    "background": "F8FAFC",
    "background_alt": "0D1B2A",
    "text_primary": "1A202C",
    "text_muted": "718096",
    "text_on_dark": "F7FAFC",
    "chart_series": ["0F4C81", "6BA3D6", "E07A2F", "2D9C4A", "C03D3D"]
  },
  "typography": {
    "heading_font": "Inter",
    "body_font": "Inter",
    "mono_font": "JetBrains Mono"
  },
  "approved_image_styles": ["clean corporate photography", "professional data visualisation", "minimal flat icons"],
  "prohibited_image_styles": ["cartoon illustrations", "hand-drawn sketches"],
  "compliance_mode": "guided",
  "extracted_at": "2026-03-29T12:00:00Z",
  "source_hash": "a1b2c3d4e5f6"
}
